Uri,Paint,Author,Museum,Genre,Movement,Content
http://www.wikidata.org/entity/Q979440,Annunciation with St. Margaret and St. Ansanus,Simone Martini,Uffizi Gallery,religious art,Gothic art,Ansano di Siena angelo Annunciazione Maria Maria Geremia Annunciazione Geremia Ansano di Siena angelo
http://www.wikidata.org/entity/Q951105,The Feast in the House of Levi,Paolo Veronese,Gallerie dell'Accademia,religious art,mannerism,Gesù uomo
http://www.wikidata.org/entity/Q9396557,Saints Louis and George with the Princess,Jacopo Tintoretto,Gallerie dell'Accademia,religious art,mannerism,nuvola damigella in pericolo uomo San Giorgio abito da donna Ludovico di Tolosa cielo drago cavallo posizione eretta gimnopodismo posizione seduta donna donna cielo cavallo San Giorgio drago abito da donna Ludovico di Tolosa gimnopodismo posizione seduta nuvola posizione eretta damigella in pericolo uomo
http://www.wikidata.org/entity/Q9301386,Ascent of the Blessed,Hieronymus Bosch,Gallerie dell'Accademia,religious art,Flemish Primitives,angelo
http://www.wikidata.org/entity/Q9281692,Adam and Eve,Jacopo Tintoretto,Gallerie dell'Accademia,nude,Venetian school,Eva mela posizione seduta Foglia di fico uomo Adamo ombelico nudità donna giardino dell'Eden schiena coppia contatto visivo tronco latifoglie cielo albero della conoscenza del bene e del male
http://www.wikidata.org/entity/Q924655,St Mark's Body Brought to Venice,Jacopo Tintoretto,Gallerie dell'Accademia,religious art,mannerism,colonna Marco evangelista cadavere Marco evangelista cadavere colonna Venezia Venezia
http://www.wikidata.org/entity/Q9068409,Portrait of Procurator Jacopo Soranzo,Jacopo Tintoretto,Gallerie dell'Accademia,portrait,Venetian school,uomo uomo
http://www.wikidata.org/entity/Q9015206,Saint John the Baptist,Caravaggio,Galleria Borghese,religious art,Baroque,Giovanni Battista
http://www.wikidata.org/entity/Q867403,Madonna with the Long Neck,Parmigianino,Uffizi,religious art,mannerism,Bambino Gesù ragazzo madre donna donna ragazzo madre Bambino Gesù Maria Maria
http://www.wikidata.org/entity/Q81761474,The Three Eldest Children of Charles I,Anthony van Dyck,Sabauda Gallery,portrait,Baroque,Giacomo II d'Inghilterra merletto berretto colletto cane Carlo II d'Inghilterra abito da donna Maria II d'Inghilterra bambino
http://www.wikidata.org/entity/Q746716,Narcissus,Caravaggio,Galleria Nazionale d'Arte Antica,mythological painting,Baroque,Narciso
http://www.wikidata.org/entity/Q745098,Rest on the Flight into Egypt,Caravaggio,Doria Pamphilj Gallery,religious art,Baroque,Sacra Famiglia angelo donna ragazzo Riposo durante la fuga in Egitto Bambino Gesù Maria
http://www.wikidata.org/entity/Q7401416,Saint Jerome in Penitence,Titian,Pinacoteca di Brera,religious art,Venetian school,San Girolamo
http://www.wikidata.org/entity/Q685916,Crucifixion of St. Peter,Caravaggio,Cerasi Chapel,religious art,Baroque,crocifissione Pietro apostolo uomo
http://www.wikidata.org/entity/Q64606195,St Anthony Preaching to the Fish,Paolo Veronese,Galleria Borghese,religious art,mannerism,folla paesaggio mare Antonio di Padova
http://www.wikidata.org/entity/Q5996597,Paradise,Jacopo Tintoretto,Doge's Palace,religious art,mannerism,angelo Maria Annunciazione Annunciazione Maria
http://www.wikidata.org/entity/Q57530584,San Domenico (Tiziano),Titian,Galleria Borghese,portrait,Renaissance,sacerdote santo sacerdote santo Domenico di Guzmán Domenico di Guzmán
http://www.wikidata.org/entity/Q572697,Pesaro Madonna,Titian,Santa Maria Gloriosa dei Frari,religious art,High Renaissance,cielo Francesco d'Assisi gimnopodismo colonna donna nuvola Pietro apostolo madre preghiera Maria chiave madre colonna cielo barba Ordine francescano Mori Antonio di Padova Bambino Gesù nuvola angelo ragazzo angelo detenuto abito da donna armoriale dei papi posizione seduta natiche barba Pietro apostolo preghiera turchi Mori Antonio di Padova ragazzo donna chiave Ordine francescano Maria nudità mantello abito da donna natiche putto armatura nudità turchi
http://www.wikidata.org/entity/Q555821,Self-portrait,Raphael,Uffizi,self-portrait,High Renaissance,Raffaello Sanzio uomo
http://www.wikidata.org/entity/Q5189812,Crucifixion,Titian,San Domenico,religious art,Venetian school,Gesù
http://www.wikidata.org/entity/Q50884435,The Sacrifice of Isaac,Alessandro Allori,Uffizi,religious art,mannerism,Isacco Abramo
http://www.wikidata.org/entity/Q50617387,Predella of the Barbadori altarpiece,Filippo Lippi,Uffizi,religious art,Renaissance,Maria Spirito Santo Agostino d'Ippona
http://www.wikidata.org/entity/Q493792,Portrait of Andrea Doria as Neptune,Agnolo Bronzino,Pinacoteca di Brera,allegory,mannerism,barba Andrea Doria nudità nudità pelo pubico Nettuno Andrea Doria tridente pelo pubico Andrea Doria nudità tridente tridente barba Nettuno Nettuno barba pelo pubico
http://www.wikidata.org/entity/Q49167493,The death of Saint Mary Magdalene,Francesco Rustici,Uffizi,religious art,Baroque,Angeli Maria Maddalena
http://www.wikidata.org/entity/Q490312,Crucifixion,Jacopo Tintoretto,Scuola Grande di San Rocco,religious art,mannerism,uomo Maria donna Gesù cavallo scala Gesù
http://www.wikidata.org/entity/Q48927682,Saint John the Evangelist and Saint Francis,El Greco,Uffizi,religious art,mannerism,Francesco d'Assisi Giovanni evangelista
http://www.wikidata.org/entity/Q45381203,Bernardino Campi Painting Sofonisba Anguissola,Sofonisba Anguissola,Pinacoteca Nazionale,portrait,mannerism,Bernardino Campi Sofonisba Anguissola
http://www.wikidata.org/entity/Q45361473,Lamentation,Plautilla Nelli,Florence,religious art,mannerism,Gesù
http://www.wikidata.org/entity/Q44421515,Seven Saints in Adoration,Bartolo di Fredi,Basilica of San Domenico,religious art,Sienese School,monaca caucasico santo
http://www.wikidata.org/entity/Q42589069,Triptych of Jan Crabbe. Center table,Hans Memling,Palazzo Chiericati,religious art,Flemish Primitives,Gesù
http://www.wikidata.org/entity/Q4009574,Venus and Adonis,Titian,Galleria Nazionale d'Arte Antica,mythological painting,Venetian school,"posizione seduta pianta del piede cappello arco natiche sonno Afrodite tempesta caccia cane da caccia Eros faretra coppia Adone dito del piede sandalo Guinzaglio brocca contatto visivo gimnopodismo Cupido uomo vestito, donna nuda alba solco intergluteo schiena nudità campagna albero donna nuvola cielo Fossette di Venere uomo Venere"
http://www.wikidata.org/entity/Q3999120,"Benedetto Portinari triptych: Right wing, Portrait of a Praying Man",Hans Memling,Uffizi,portrait,Flemish Primitives,Benedetto d'Aniane
http://www.wikidata.org/entity/Q3999110,Annunciation Triptych,Rogier van der Weyden,Sabauda Gallery,religious art,Flemish Primitives,Annunciazione donna Maria angelo
http://www.wikidata.org/entity/Q3978276,Susannah and the Elders,Paolo Veronese,Palazzo Bianco,nude,mannerism,Susanna topless donna igiene corporale Susanna topless donna mammella igiene corporale mammella
http://www.wikidata.org/entity/Q3947595,St. Mark Enthroned,Titian,Santa Maria della Salute,religious art,Venetian school,donna Maria
http://www.wikidata.org/entity/Q3947211,Saint George,Titian,Cini Foundation,religious art,Venetian school,drago armatura San Giorgio armatura posizione eretta uomo San Giorgio drago posizione eretta uomo
http://www.wikidata.org/entity/Q3946912,Saint Christopher,Jacopo Tintoretto,Museo d'Arte Sacra San Martino,religious art,Venetian school,San Cristoforo
http://www.wikidata.org/entity/Q3946910,Saint Christopher,Titian,Doge's Palace,religious art,Venetian school,Bambino Gesù ragazzo San Cristoforo
http://www.wikidata.org/entity/Q3944515,Balbi Holy Conversation,Titian,Fondazione Magnani-Rocca,religious art,Venetian school,Bambino Gesù donna madre ragazzo Maria
http://www.wikidata.org/entity/Q3937774,Equestrian portrait of Anton Giulio Brignole-Sale,Anthony van Dyck,Palazzo Rosso,equestrian portrait,Baroque,uomo cavallo Anton Giulio Brignole Sale equitazione
http://www.wikidata.org/entity/Q3937768,Portrait of a gentleman in a fur,Paolo Veronese,Galleria Palatina,portrait,mannerism,Daniele Barbaro
http://www.wikidata.org/entity/Q3937761,Knight of Malta,Titian,Uffizi Gallery,religious art,Venetian school,ragazzo Maria Maria ragazzo donna donna Bambino Gesù Bambino Gesù
http://www.wikidata.org/entity/Q3937643,Portrait of Pope Paul III,Titian,National Museum of Capodimonte,portrait,Venetian school,papa Paolo III
http://www.wikidata.org/entity/Q3937569,Portrait of Ippolito de' Medici,Titian,Palazzo Pitti,portrait,Venetian school,Ippolito de' Medici uomo
http://www.wikidata.org/entity/Q3937561,Giulio Clovia,El Greco,National Museum of Capodimonte,portrait,mannerism,Giulio Clovio
http://www.wikidata.org/entity/Q3937531,Portrait of Francesco Maria della Rovere,Titian,Uffizi Gallery,portrait,Venetian school,Francesco Maria I Della Rovere armatura
http://www.wikidata.org/entity/Q3937511,Portrait of Eleonora Gonzaga,Titian,Uffizi Gallery,portrait,Venetian school,Eleonora Gonzaga della Rovere
http://www.wikidata.org/entity/Q3937458,Portrait of Alvise Cornaro,Jacopo Tintoretto,Palazzo Pitti,portrait,Venetian school,Alvise Corner uomo
http://www.wikidata.org/entity/Q3937435,Equestrian portrait of Prince Tomaso of Savoy-Carignan (1595–1656),Anthony van Dyck,Sabauda Gallery,equestrian portrait,Baroque,uomo equitazione militare merletto tenda colonna nuvola capelli lunghi morso colletto piante panneggio Tommaso Francesco di Savoia pizzetto Bastone da feldmaresciallo staffa militare capelli lunghi staffa panneggio morso cielo sciarpa (distintivo) colletto sciarpa (distintivo) porta baffi pizzetto colonna porta baffi cavallo piante nuvola Bastone da feldmaresciallo equitazione testiera tenda armatura merletto Tommaso Francesco di Savoia cielo uomo armatura cavallo testiera
http://www.wikidata.org/entity/Q3937427,Portrait of Cardinal Guido Bentivoglio,Anthony van Dyck,Galleria Palatina,portrait,Baroque,Guido Bentivoglio
http://www.wikidata.org/entity/Q3910929,The Presentation of the Virgin at the Temple,Titian,Gallerie dell'Accademia,religious art,Venetian school,Maria
http://www.wikidata.org/entity/Q3910087,St. Mark Preaching in Alexandria,Gentile Bellini,Pinacoteca di Brera,religious art,Renaissance,Alessandria d'Egitto obelisco dromedario obelisco dromedario Alessandria d'Egitto Giraffa settentrionale Marco evangelista Marco evangelista Giraffa settentrionale
http://www.wikidata.org/entity/Q3907473,Averoldi Polyptych,Titian,Brescia,religious art,Venetian school,uomo Annunciazione Gesù Maria donna angelo
http://www.wikidata.org/entity/Q3889243,Altarpiece Gambassi,Andrea del Sarto,Galleria Palatina,religious art,High Renaissance,Bambino Gesù donna madre ragazzo capelli lunghi Maria Maddalena Maria
http://www.wikidata.org/entity/Q3889203,Gozzi Altarpiece,Titian,"Pinacoteca civica ""Francesco Podesti""",religious art,Venetian school,Bambino Gesù Francesco d'Assisi apparizioni e altre manifestazioni mariane Biagio di Sebaste
http://www.wikidata.org/entity/Q3885620,Orpheus and Eurydice,Titian,Accademia Carrara,mythological painting,Venetian school,Euridice Orfeo
http://www.wikidata.org/entity/Q3877890,Noli me tangere,Andrea del Sarto,Museum of the Last Supper of Andrea del Sarto,religious art,High Renaissance,"croce parterre gimnopodismo capelli lunghi torso nudo albero Ars topiaria donna vestita, uomo nudo uomo giardino erba collina Prospettiva aerea meandro Maria Maddalena corso d'acqua paesaggio chiasmo Gesù cielo montagna donna nuvola"
http://www.wikidata.org/entity/Q3873239,Nativity of Christ with angels,Parmigianino,Doria Pamphilj Gallery,religious art,High Renaissance,Bambino Gesù Maria ragazzo donna
http://www.wikidata.org/entity/Q3870475,The Birth of Adonis,Titian,Civic Museums of Padua,mythological painting,Venetian school,parto Adone
http://www.wikidata.org/entity/Q3850323,The Martyrdom of Saint Erasmus,Nicolas Poussin,Pinacoteca Vaticana,religious art,Classicism,Erasmo di Formia
http://www.wikidata.org/entity/Q3850318,Martyrdom of Saint Agatha,Giovanni Battista Tiepolo,Basilica of Saint Anthony of Padua,religious art,Rococo,Sant'Agata
http://www.wikidata.org/entity/Q3842767,Madonna enthroned with child and two musical angels,Hans Memling,Uffizi,religious art,Flemish Primitives,madre Maria Bambino Gesù ragazzo donna
http://www.wikidata.org/entity/Q3842700,The Madonna and Child with the Infant Saint John the Baptist and Saint Anthony Abbot,Titian,Uffizi,religious art,Venetian school,Rosa madre Maria donna Antonio abate Bambino Gesù ragazzo San Giovannino
http://www.wikidata.org/entity/Q3842642,Madonna Casini,Masaccio,Uffizi Gallery,religious art,Italian Renaissance,Maria
http://www.wikidata.org/entity/Q3842594,Madonna and the Child between Saints Catherine and Mary Magdalene,Giovanni Bellini,Gallerie dell'Accademia,religious art,Renaissance,capelli lunghi Maria Maddalena ragazzo Bambino Gesù Maria Caterina d'Alessandria madre donna
http://www.wikidata.org/entity/Q3842591,Madonna with Child in glory and with Saints Andrew and Peter,Titian,Serravalle Cathedral,religious art,Venetian school,ragazzo madre Maria Pietro apostolo Andrea apostolo Bambino Gesù donna
http://www.wikidata.org/entity/Q3842413,Madonna and Child in a landscape,Titian,Accademia Carrara,religious art,Venetian school,madre Maria Bambino Gesù ragazzo donna
http://www.wikidata.org/entity/Q3794586,The Martyrdom of Saint Bartholomeo,Giovanni Battista Tiepolo,San Stae,religious art,Rococo,Bartolomeo apostolo
http://www.wikidata.org/entity/Q3784247,La Bella,Titian,Palazzo Pitti,portrait,Venetian school,Eleonora Gonzaga della Rovere Isabella d'Este capelli lunghi collana orecchino donna abito da donna Angela del Moro
http://www.wikidata.org/entity/Q3754067,The Flight into Egypt,Jacopo Tintoretto,Scuola Grande di San Rocco,religious art,mannerism,ragazzo Bambino Gesù ragazzo Maria donna Bambino Gesù donna Maria
http://www.wikidata.org/entity/Q3715966,Two Venetian Ladies,Vittore Carpaccio,Museo Correr,genre art,Italian Renaissance,Columbidae bambino collana fazzoletto cane donna donna fazzoletto pianella collana bambino Columbidae cane pianella
http://www.wikidata.org/entity/Q3710271,Disputation of St Stephen,Vittore Carpaccio,Pinacoteca di Brera,religious art,Italian Renaissance,Conflict Stefano
http://www.wikidata.org/entity/Q3698229,Crucifixion of St. Peter,Luca Giordano,Gallerie dell'Accademia,religious art,Baroque,Pietro apostolo
http://www.wikidata.org/entity/Q3698216,Saint Dominic adoring the Crucifixion,Fra Angelico,Museum of San Marco,religious art,Italian Renaissance,Domenico di Guzmán
http://www.wikidata.org/entity/Q3697665,Christ Carrying the Cross,Titian,Scuola Grande di San Rocco,religious art,Venetian school,Gesù uomo
http://www.wikidata.org/entity/Q3680519,Cleopatra,Artemisia Gentileschi,Ferrara,nude,Caravaggisti,topless sovrappeso ombelico Vipera aspis spalla Cleopatra posizione seduta morso di serpent i love cheese mammella posizione seduta panneggio topless morso di serpent i love cheese panneggio sovrappeso Vipera aspis donna capelli lunghi Cleopatra spalla capelli lunghi suicidio suicidio mammella ombelico
http://www.wikidata.org/entity/Q3636748,The Baptism of Christ,Titian,Capitoline Museums,religious art,Venetian school,uomo Gesù
http://www.wikidata.org/entity/Q3627399,Assumption,Titian,Verona Cathedral,religious art,Venetian school,Maria donna
http://www.wikidata.org/entity/Q3620765,Apotheosis of Angelo della Vecchia,Giovanni Battista Tiepolo,Palazzo Isimbardi,religious art,Rococo,apoteosi
http://www.wikidata.org/entity/Q3618192,Malchiostro Annunciation,Titian,Treviso,religious art,Venetian school,donatore Maria angelo donna Annunciazione
http://www.wikidata.org/entity/Q3605529,Adoration of the Magi,Gerard David,Uffizi Gallery,religious art,Flemish Primitives,donna ragazzo Magi Bambino Gesù adorazione Maria
http://www.wikidata.org/entity/Q3495790,Salome,Titian,Doria Pamphilj Gallery,religious art,Venetian school,testa umana Salomè vassoio donna
http://www.wikidata.org/entity/Q3463869,Saint John the Baptist,Caravaggio,Galleria Nazionale d'Arte Antica,religious art,Baroque,Giovanni Battista
http://www.wikidata.org/entity/Q3428030,Pala Baglioni,Raphael,Galleria Borghese,religious art,High Renaissance,Gesù
http://www.wikidata.org/entity/Q32904769,Madonna and Child with Saint Catherine,anonymous,Uffizi Gallery,religious art,mannerism,Caterina d'Alessandria Maria Maria Caterina d'Alessandria Gesù Gesù
http://www.wikidata.org/entity/Q3276180,Madonna with the laughing Child,Giotto di Bondone,Upper Basilica of San Francesco d'Assisi,religious art,Proto-Renaissance,Maria
http://www.wikidata.org/entity/Q3276171,Madonna de San Giorgio alla Costa,Giotto di Bondone,Museo diocesano di Santo Stefano al Ponte,religious art,Proto-Renaissance,Maria
http://www.wikidata.org/entity/Q3276168,Madonna of Borgo San Lorenzo,Giotto di Bondone,Pieve di San Lorenzo,religious art,Proto-Renaissance,Maria
http://www.wikidata.org/entity/Q3223625,Young Saint John the Baptist with ram,Caravaggio,Capitoline Museums,religious art,Baroque,Giovanni Battista
http://www.wikidata.org/entity/Q3213771,Madonna in Glory with Saints,Pietro Perugino,Pinacoteca Nazionale di Bologna,religious art,Italian Renaissance,donna Bambino Gesù Maria ragazzo
http://www.wikidata.org/entity/Q3213763,Madonna with child,Pietro Perugino,Galleria Nazionale dell'Umbria,religious art,Italian Renaissance,donna Bambino Gesù ragazzo Maria madre
http://www.wikidata.org/entity/Q3213753,"Madonna with child, Saint John the Baptist, and an angel",Pietro Perugino,Galleria Palatina,religious art,Italian Renaissance,donna ragazzo Maria San Giovannino Bambino Gesù
http://www.wikidata.org/entity/Q3202078,Annunciation of San Giovanni Valdarno,Fra Angelico,San Giovanni Valdarno,religious art,Italian Renaissance,donna Maria
http://www.wikidata.org/entity/Q29654663,Portrait of Paolo Morigia,Fede Galizia,Pinacoteca Ambrosiana,portrait,mannerism,umano
http://www.wikidata.org/entity/Q2920183,Annunciation,Titian,Venice,religious art,Venetian school,bebè luce Maria Arcangelo Gabriele Annunciazione angelo donna
http://www.wikidata.org/entity/Q2872721,Self-portrait in Uffizi,Jacques-Louis David,Uffizi Gallery,portrait,neoclassicism,Jacques-Louis David uomo uomo Jacques-Louis David
http://www.wikidata.org/entity/Q28147005,Christ Resurrected,Titian,Uffizi Gallery,religious art,Renaissance,Gesù uomo bandiera
http://www.wikidata.org/entity/Q27857536,Rest on the Flight into Egypt,Carlo Saraceni,Frascati,religious art,Baroque,Fuga in Egitto
http://www.wikidata.org/entity/Q27830737,Summer,Carlo Maratta,Ariccia,allegory,Baroque,L'estate L'estate
http://www.wikidata.org/entity/Q2734111,"Portrait of Maffeo Barberini, late Pope Urbanus VIII",Caravaggio,Florence,portrait,Baroque,papa Urbano VIII
http://www.wikidata.org/entity/Q2732274,Penitent Magdalene,Caravaggio,Doria Pamphilj Gallery,religious art,Baroque,donna abito da donna coda di cavallo Maria Maddalena perla posizione seduta capelli lunghi mortificazione bigiotteria
http://www.wikidata.org/entity/Q2715302,Madonna and Child with St. Anne,Caravaggio,Galleria Borghese,religious art,Baroque,Maria abito da donna ombelico castani Anna madre aureola gimnopodismo Bambino Gesù ragazzo nudità capelli lunghi chignon serpente donna nonna
http://www.wikidata.org/entity/Q2715177,Saint Jerome Writing,Caravaggio,Galleria Borghese,religious art,Baroque,San Girolamo
http://www.wikidata.org/entity/Q2713203,Madonna di Loreto,Caravaggio,Basilica of Sant' Agostino,religious art,Baroque,donna Bambino Gesù ragazzo madre Maria
http://www.wikidata.org/entity/Q27058605,Game of Chess,Giulio Campi,Turin,genre art,Renaissance,scacchi
http://www.wikidata.org/entity/Q26767071,Vision of the Blessed Amedeo Menez de Sylva,Pedro Fernández de Murcia,Palazzo Barberini,religious art,Renaissance,paradiso
http://www.wikidata.org/entity/Q2665840,Pietà,Titian,Gallerie dell'Accademia,religious art,Venetian school,Maria Gesù
http://www.wikidata.org/entity/Q2627056,David with the Head of Goliath,Caravaggio,Galleria Borghese,religious art,Baroque,testa uomo spada testa spada Caravaggio Caravaggio Davide uomo Davide
http://www.wikidata.org/entity/Q2626595,The Seven Works of Mercy,Caravaggio,Pio Monte della Misericordia,religious art,Baroque,Opera di misericordia
http://www.wikidata.org/entity/Q2610936,Boy with a Basket of Fruit,Caravaggio,Galleria Borghese,portrait,Baroque,ragazzo mela fico cesto uva pesca
http://www.wikidata.org/entity/Q2604155,Lamentation of Christ,Rogier van der Weyden,Uffizi,religious art,Flemish Primitives,Maria Maddalena uomo capelli lunghi Compianto sul Cristo morto Gesù donna
http://www.wikidata.org/entity/Q25395333,Chess Players,anonymous,Gallerie dell'Accademia,genre art,Baroque,scacchista
http://www.wikidata.org/entity/Q2472983,Last Supper,Jacopo Tintoretto,Church of San Giorgio Maggiore,religious art,Venetian school,uomo uomo Gesù Gesù
http://www.wikidata.org/entity/Q2470123,Judith Beheading Holofernes,Caravaggio,Palazzo Barberini,religious art,Baroque,"scimitarra lavoro domestico rossi uomo tenda omicidio barba posizione eretta persona anziana decubito castani panneggio sangue nudità letto Cuffia (copricapo) donna vestita, uomo nudo abito da donna orecchino Giuditta Fillide Melandroni lenzuolo Oloferne agonia decapitazione donna"
http://www.wikidata.org/entity/Q2467518,Visions of the Hereafter,Hieronymus Bosch,Gallerie dell'Accademia,religious art,Flemish Primitives,vita dopo la morte
http://www.wikidata.org/entity/Q2446983,Scenes from the Passion of Christ,Hans Memling,Sabauda Gallery,religious art,Flemish Primitives,Gesù
http://www.wikidata.org/entity/Q2429754,Sleeping Cupid,Caravaggio,Palazzo Pitti,mythological painting,Baroque,Cupido Cupido
http://www.wikidata.org/entity/Q2397593,Tavola Doria,Leonardo da Vinci,Uffizi,history painting,High Renaissance,Battaglia di Anghiari
http://www.wikidata.org/entity/Q2390224,Wilgefortis Triptych,Hieronymus Bosch,Gallerie dell'Accademia,religious art,Flemish Primitives,Vilgefortis Vilgefortis
http://www.wikidata.org/entity/Q2338417,The Martyrdom of Saint Matthew,Caravaggio,San Luigi dei Francesi Church,religious art,Baroque,Matteo apostolo ed evangelista uomo
http://www.wikidata.org/entity/Q2337873,The Inspiration of Saint Matthew,Caravaggio,Contarelli Chapel,religious art,Baroque,Matteo apostolo ed evangelista angelo
http://www.wikidata.org/entity/Q2327715,Adoration of the Shepherds,Caravaggio,Regional museum of Messina,religious art,Baroque,donna Maria Bambino Gesù ragazzo
http://www.wikidata.org/entity/Q2325834,Ecce Homo,Caravaggio,Palazzo Bianco,religious art,Baroque,Gesù uomo
http://www.wikidata.org/entity/Q23008305,Portrait of the Artist's Sisters Playing Chess,Sofonisba Anguissola,Cremona,group portrait,mannerism,scacchiera Europa Anguissola scacchi Lucia Anguissola lavoro domestico ragazza donna
http://www.wikidata.org/entity/Q2293936,Young Sick Bacchus,Caravaggio,Galleria Borghese,self-portrait,Baroque,Caravaggio Caravaggio
http://www.wikidata.org/entity/Q2284829,Sacrifice of Isaac,Caravaggio,Uffizi,religious art,Baroque,Abramo angelo Isacco
http://www.wikidata.org/entity/Q2277635,The Raising of Lazarus,Caravaggio,Regional museum of Messina,religious art,Baroque,uomo Gesù
http://www.wikidata.org/entity/Q2273517,Conversion on the Way to Damascus,Caravaggio,Cerasi Chapel,religious art,Baroque,conversione di Paolo
http://www.wikidata.org/entity/Q2270291,Basket of Fruit,Caravaggio,Pinacoteca Ambrosiana,still life,Baroque,uva pera mela fico foglia cesto
http://www.wikidata.org/entity/Q2268013,Madonna and Child and Two Angels,Sandro Botticelli,National Museum of Capodimonte,religious art,Early Renaissance,madre ragazzo Bambino Gesù Maria donna
http://www.wikidata.org/entity/Q2264942,The Flagellation of Christ,Caravaggio,National Museum of Capodimonte,religious art,Baroque,uomo Gesù
http://www.wikidata.org/entity/Q21204021,"Portrait Group with the Artist’s Father, Brother and Sister",Sofonisba Anguissola,Cremona,group portrait,mannerism,cane famiglia
http://www.wikidata.org/entity/Q2097931,Supper at Emmaus,Caravaggio,Pinacoteca di Brera,religious art,Baroque,Gesù eucaristia
http://www.wikidata.org/entity/Q2066739,San Zeno Altarpiece,Andrea Mantegna,Basilica of San Zeno,religious art,Renaissance,angelo Maria madre Bambino Gesù ragazzo donna
http://www.wikidata.org/entity/Q2046100,Flora,Titian,Uffizi,allegory,Venetian school,capelli lunghi Camicia biondi Flora donna
http://www.wikidata.org/entity/Q204243,St. Roch in Glory,Jacopo Tintoretto,Scuola Grande di San Rocco,religious art,mannerism,umano San Rocco
http://www.wikidata.org/entity/Q20019223,Portrait of Child (by Gianlorenzo Bernini),Gian Lorenzo Bernini,Galleria Borghese,portrait,Baroque,ragazzo
http://www.wikidata.org/entity/Q19904761,David with Head of Goliath,Gian Lorenzo Bernini,Galleria Nazionale d'Arte Antica,religious art,Baroque,Golia Davide
http://www.wikidata.org/entity/Q19904754,Self Portrait of Gianlorenzo Bernini (1638-40),Gian Lorenzo Bernini,Galleria Borghese,self-portrait,Baroque,Gian Lorenzo Bernini
http://www.wikidata.org/entity/Q19904750,Self Portrait of Gianlorenzo Bernini (1630),Gian Lorenzo Bernini,Uffizi Gallery,self-portrait,Baroque,Gian Lorenzo Bernini
http://www.wikidata.org/entity/Q19882485,Portrait of Pope Urban VIII,Gian Lorenzo Bernini,Galleria Nazionale d'Arte Antica,portrait,Baroque,papa Urbano VIII
http://www.wikidata.org/entity/Q19882428,Self Portrait of Gianlorenzo Bernini (1623),Gian Lorenzo Bernini,Galleria Borghese,self-portrait,Baroque,Gian Lorenzo Bernini
http://www.wikidata.org/entity/Q1899740,Assumption of the Virgin,Titian,Santa Maria Gloriosa dei Frari,religious art,High Renaissance,donna donna Assunzione di Maria Maria Maria Assunzione di Maria
http://www.wikidata.org/entity/Q180632,Pope Paul III and his Grandsons,Titian,National Museum of Capodimonte,portrait,Venetian school,Ottavio Farnese Alessandro Farnese il Giovane papa Paolo III
